{
  "backend": "serial",
  "complete_all14": true,
  "environment": {
    "baudrate": 1000000,
    "device": "/dev/ttyACM0",
    "hardware_authorized": true,
    "platform": "Linux-6.1.83-aarch64-with-glibc2.35",
    "python": "3.10.12",
    "repository_commit": "c634af78d78d378b396b80dc2dd6ad7cde300477",
    "suspended_or_benched": true,
    "timeout_ms": 4.0
  },
  "finding": "uniform_model_and_limits",
  "halt_reason": null,
  "hardware_gate_status": "NOT_ADVANCED_DIAGNOSTIC_ONLY",
  "informational_only": false,
  "read_order": [
    20,
    21,
    22,
    23,
    24,
    30,
    31,
    32,
    33,
    10,
    11,
    12,
    14,
    13
  ],
  "records": [
    {
      "logical_index": 0,
      "max_voltage_raw": 80,
      "max_voltage_v": 8.0,
      "min_voltage_raw": 40,
      "min_voltage_v": 4.0,
      "model_high": 3,
      "model_low": 9,
      "model_raw": 777,
      "model_read": {
        "address": 3,
        "data": [
          9,
          3
        ],
        "device_status_raw": 1,
        "length": 2,
        "response_length": 2,
        "response_status": "device",
        "round_trip_ms": 0.621922
      },
      "servo_id": 20,
      "voltage_limit_read": {
        "address": 14,
        "data": [
          80,
          40
        ],
        "device_status_raw": 1,
        "length": 2,
        "response_length": 2,
        "response_status": "device",
        "round_trip_ms": 0.406296
      },
      "wire_index": 0
    },
    {
      "logical_index": 1,
      "max_voltage_raw": 80,
      "max_voltage_v": 8.0,
      "min_voltage_raw": 40,
      "min_voltage_v": 4.0,
      "model_high": 3,
      "model_low": 9,
      "model_raw": 777,
      "model_read": {
        "address": 3,
        "data": [
          9,
          3
        ],
        "device_status_raw": 1,
        "length": 2,
        "response_length": 2,
        "response_status": "device",
        "round_trip_ms": 0.392212
      },
      "servo_id": 21,
      "voltage_limit_read": {
        "address": 14,
        "data": [
          80,
          40
        ],
        "device_status_raw": 1,
        "length": 2,
        "response_length": 2,
        "response_status": "device",
        "round_trip_ms": 0.394504
      },
      "wire_index": 1
    },
    {
      "logical_index": 2,
      "max_voltage_raw": 80,
      "max_voltage_v": 8.0,
      "min_voltage_raw": 40,
      "min_voltage_v": 4.0,
      "model_high": 3,
      "model_low": 9,
      "model_raw": 777,
      "model_read": {
        "address": 3,
        "data": [
          9,
          3
        ],
        "device_status_raw": 1,
        "length": 2,
        "response_length": 2,
        "response_status": "device",
        "round_trip_ms": 0.400962
      },
      "servo_id": 22,
      "voltage_limit_read": {
        "address": 14,
        "data": [
          80,
          40
        ],
        "device_status_raw": 1,
        "length": 2,
        "response_length": 2,
        "response_status": "device",
        "round_trip_ms": 0.391587
      },
      "wire_index": 2
    },
    {
      "logical_index": 3,
      "max_voltage_raw": 80,
      "max_voltage_v": 8.0,
      "min_voltage_raw": 40,
      "min_voltage_v": 4.0,
      "model_high": 3,
      "model_low": 9,
      "model_raw": 777,
      "model_read": {
        "address": 3,
        "data": [
          9,
          3
        ],
        "device_status_raw": 1,
        "length": 2,
        "response_length": 2,
        "response_status": "device",
        "round_trip_ms": 0.391461
      },
      "servo_id": 23,
      "voltage_limit_read": {
        "address": 14,
        "data": [
          80,
          40
        ],
        "device_status_raw": 1,
        "length": 2,
        "response_length": 2,
        "response_status": "device",
        "round_trip_ms": 0.418754
      },
      "wire_index": 3
    },
    {
      "logical_index": 4,
      "max_voltage_raw": 80,
      "max_voltage_v": 8.0,
      "min_voltage_raw": 40,
      "min_voltage_v": 4.0,
      "model_high": 3,
      "model_low": 9,
      "model_raw": 777,
      "model_read": {
        "address": 3,
        "data": [
          9,
          3
        ],
        "device_status_raw": 1,
        "length": 2,
        "response_length": 2,
        "response_status": "device",
        "round_trip_ms": 0.382962
      },
      "servo_id": 24,
      "voltage_limit_read": {
        "address": 14,
        "data": [
          80,
          40
        ],
        "device_status_raw": 1,
        "length": 2,
        "response_length": 2,
        "response_status": "device",
        "round_trip_ms": 0.387212
      },
      "wire_index": 4
    },
    {
      "logical_index": 5,
      "max_voltage_raw": 80,
      "max_voltage_v": 8.0,
      "min_voltage_raw": 40,
      "min_voltage_v": 4.0,
      "model_high": 3,
      "model_low": 9,
      "model_raw": 777,
      "model_read": {
        "address": 3,
        "data": [
          9,
          3
        ],
        "device_status_raw": 1,
        "length": 2,
        "response_length": 2,
        "response_status": "device",
        "round_trip_ms": 0.384295
      },
      "servo_id": 30,
      "voltage_limit_read": {
        "address": 14,
        "data": [
          80,
          40
        ],
        "device_status_raw": 1,
        "length": 2,
        "response_length": 2,
        "response_status": "device",
        "round_trip_ms": 0.414879
      },
      "wire_index": 5
    },
    {
      "logical_index": 6,
      "max_voltage_raw": 80,
      "max_voltage_v": 8.0,
      "min_voltage_raw": 40,
      "min_voltage_v": 4.0,
      "model_high": 3,
      "model_low": 9,
      "model_raw": 777,
      "model_read": {
        "address": 3,
        "data": [
          9,
          3
        ],
        "device_status_raw": 1,
        "length": 2,
        "response_length": 2,
        "response_status": "device",
        "round_trip_ms": 0.452837
      },
      "servo_id": 31,
      "voltage_limit_read": {
        "address": 14,
        "data": [
          80,
          40
        ],
        "device_status_raw": 1,
        "length": 2,
        "response_length": 2,
        "response_status": "device",
        "round_trip_ms": 0.397962
      },
      "wire_index": 6
    },
    {
      "logical_index": 7,
      "max_voltage_raw": 80,
      "max_voltage_v": 8.0,
      "min_voltage_raw": 40,
      "min_voltage_v": 4.0,
      "model_high": 3,
      "model_low": 9,
      "model_raw": 777,
      "model_read": {
        "address": 3,
        "data": [
          9,
          3
        ],
        "device_status_raw": 1,
        "length": 2,
        "response_length": 2,
        "response_status": "device",
        "round_trip_ms": 0.384504
      },
      "servo_id": 32,
      "voltage_limit_read": {
        "address": 14,
        "data": [
          80,
          40
        ],
        "device_status_raw": 1,
        "length": 2,
        "response_length": 2,
        "response_status": "device",
        "round_trip_ms": 0.385087
      },
      "wire_index": 7
    },
    {
      "logical_index": 8,
      "max_voltage_raw": 80,
      "max_voltage_v": 8.0,
      "min_voltage_raw": 40,
      "min_voltage_v": 4.0,
      "model_high": 3,
      "model_low": 9,
      "model_raw": 777,
      "model_read": {
        "address": 3,
        "data": [
          9,
          3
        ],
        "device_status_raw": 1,
        "length": 2,
        "response_length": 2,
        "response_status": "device",
        "round_trip_ms": 0.416712
      },
      "servo_id": 33,
      "voltage_limit_read": {
        "address": 14,
        "data": [
          80,
          40
        ],
        "device_status_raw": 1,
        "length": 2,
        "response_length": 2,
        "response_status": "device",
        "round_trip_ms": 0.388045
      },
      "wire_index": 8
    },
    {
      "logical_index": 9,
      "max_voltage_raw": 80,
      "max_voltage_v": 8.0,
      "min_voltage_raw": 40,
      "min_voltage_v": 4.0,
      "model_high": 3,
      "model_low": 9,
      "model_raw": 777,
      "model_read": {
        "address": 3,
        "data": [
          9,
          3
        ],
        "device_status_raw": 1,
        "length": 2,
        "response_length": 2,
        "response_status": "device",
        "round_trip_ms": 0.394462
      },
      "servo_id": 10,
      "voltage_limit_read": {
        "address": 14,
        "data": [
          80,
          40
        ],
        "device_status_raw": 1,
        "length": 2,
        "response_length": 2,
        "response_status": "device",
        "round_trip_ms": 0.391795
      },
      "wire_index": 9
    },
    {
      "logical_index": 10,
      "max_voltage_raw": 80,
      "max_voltage_v": 8.0,
      "min_voltage_raw": 40,
      "min_voltage_v": 4.0,
      "model_high": 3,
      "model_low": 9,
      "model_raw": 777,
      "model_read": {
        "address": 3,
        "data": [
          9,
          3
        ],
        "device_status_raw": 1,
        "length": 2,
        "response_length": 2,
        "response_status": "device",
        "round_trip_ms": 0.393087
      },
      "servo_id": 11,
      "voltage_limit_read": {
        "address": 14,
        "data": [
          80,
          40
        ],
        "device_status_raw": 1,
        "length": 2,
        "response_length": 2,
        "response_status": "device",
        "round_trip_ms": 0.384337
      },
      "wire_index": 10
    },
    {
      "logical_index": 11,
      "max_voltage_raw": 80,
      "max_voltage_v": 8.0,
      "min_voltage_raw": 40,
      "min_voltage_v": 4.0,
      "model_high": 3,
      "model_low": 9,
      "model_raw": 777,
      "model_read": {
        "address": 3,
        "data": [
          9,
          3
        ],
        "device_status_raw": 1,
        "length": 2,
        "response_length": 2,
        "response_status": "device",
        "round_trip_ms": 0.401296
      },
      "servo_id": 12,
      "voltage_limit_read": {